{
  "schemaVersion": 1,
  "recipeId": "voice-chinese-darwin-arm64-v1",
  "releaseMatrix": {
    "matrixId": "voice-runtime-darwin-arm64-v1",
    "sha256": "f3f57336d2598bc7c78ba0d8a10e6ad4da77c16b10274533986f29571d6de76d"
  },
  "package": {
    "profileId": "chinese",
    "languageMode": "zh",
    "platform": "darwin",
    "architecture": "arm64",
    "packageId": "voice.chinese.fun-asr-nano-0.6b-gguf-q8.darwin-arm64",
    "providerId": "autobyteus.voice.funasr-nano-q8",
    "modelId": "fun-asr-nano-gguf-q8",
    "decision": "select"
  },
  "inputs": [
    {
      "kind": "git-checkout",
      "role": "funasr-source",
      "destination": "funasr-source",
      "repository": "https://github.com/FunAudioLLM/Fun-ASR.git",
      "revision": "53a56d80667320b44a7dd779f5bf8c024b6c30a8",
      "treeId": "60ab5bc5658100856984773714347f1d03b73e7d",
      "licenseComponentId": "funasr"
    },
    {
      "kind": "git-checkout",
      "role": "llama-cpp-source",
      "destination": "llama-cpp-source",
      "repository": "https://github.com/ggml-org/llama.cpp.git",
      "revision": "8086439a4cea94c71a5dfb8fe4ad1546aebd640f",
      "treeId": "6de5862fca5eb1d6241e75b65df90257ee362f6a",
      "licenseComponentId": "llama.cpp"
    },
    {
      "kind": "git-checkout",
      "role": "utf8proc-source",
      "destination": "utf8proc-source",
      "repository": "https://github.com/JuliaStrings/utf8proc.git",
      "revision": "a1b99daa2a3393884220264c927a48ba1251a9c6",
      "treeId": "b5b227d68996d6e0cdafd9bf4bdb53cf5f05f339",
      "licenseComponentId": "utf8proc"
    },
    {
      "kind": "cache-object",
      "role": "model",
      "destination": "model/funasr-encoder-f16.gguf",
      "sizeBytes": 469331008,
      "sha256": "f92f91d01a24fbed6c863495b2ee8c6a6788144a02858b75743f0946668de8a2",
      "upstream": "https://huggingface.co/FunAudioLLM/Fun-ASR-Nano-GGUF/resolve/46e849502a867080d66d351b8dfb1018b607e509/funasr-encoder-f16.gguf",
      "licenseComponentId": "fun-asr-nano-gguf"
    },
    {
      "kind": "cache-object",
      "role": "model",
      "destination": "model/qwen3-0.6b-q8_0.gguf",
      "sizeBytes": 804753280,
      "sha256": "819f385dc0e035dccc3d9e7edaf6b7b044b8ba7ace63cbcbf84c7e397eecbf27",
      "upstream": "https://huggingface.co/FunAudioLLM/Fun-ASR-Nano-GGUF/resolve/46e849502a867080d66d351b8dfb1018b607e509/qwen3-0.6b-q8_0.gguf",
      "licenseComponentId": "fun-asr-nano-gguf"
    },
    {
      "kind": "cache-object",
      "role": "model",
      "destination": "model/fsmn-vad.gguf",
      "sizeBytes": 1720512,
      "sha256": "1270f2559c495f4e7b6e739541151027d360761a3fda43fc147034f5719f5479",
      "upstream": "https://huggingface.co/FunAudioLLM/fsmn-vad-GGUF/resolve/6840bae4c5c92ee8c04faaf4db23dd0105098d7f/fsmn-vad.gguf",
      "licenseComponentId": "fun-asr-nano-gguf"
    },
    {
      "kind": "repository-file",
      "role": "package-notice",
      "destination": "package-notices/THIRD_PARTY_NOTICES.json",
      "sourcePath": "release/compliance/package-notices/chinese/THIRD_PARTY_NOTICES.json",
      "sizeBytes": 2039,
      "sha256": "1d794497c64ba28c1158b51d215159651657cf660e2910cfaaa276dfe1ab2a1a",
      "licenseComponentId": "fun-asr-nano-gguf"
    },
    {
      "kind": "repository-file",
      "role": "package-notice",
      "destination": "package-notices/licenses/FUNASR-LICENSE.txt",
      "sourcePath": "release/compliance/package-notices/chinese/licenses/FUNASR-LICENSE.txt",
      "sizeBytes": 11357,
      "sha256": "c71d239df91726fc519c6eb72d318ec65820627232b2f796219e87dcf35d0ab4",
      "licenseComponentId": "funasr"
    },
    {
      "kind": "repository-file",
      "role": "package-notice",
      "destination": "package-notices/licenses/GO-LICENSE.txt",
      "sourcePath": "release/compliance/package-notices/chinese/licenses/GO-LICENSE.txt",
      "sizeBytes": 1453,
      "sha256": "911f8f5782931320f5b8d1160a76365b83aea6447ee6c04fa6d5591467db9dad",
      "licenseComponentId": "go"
    },
    {
      "kind": "repository-file",
      "role": "package-notice",
      "destination": "package-notices/licenses/MIT-LICENSE.txt",
      "sourcePath": "release/compliance/package-notices/chinese/licenses/MIT-LICENSE.txt",
      "sizeBytes": 1036,
      "sha256": "508a77d2e7b51d98adeed32648ad124b7b30241a8e70b2e72c99f92d8e5874d1",
      "licenseComponentId": "llama.cpp"
    },
    {
      "kind": "repository-file",
      "role": "package-notice",
      "destination": "package-notices/licenses/OPENCC-DATA-APACHE-2.0.txt",
      "sourcePath": "release/compliance/package-notices/chinese/licenses/OPENCC-DATA-APACHE-2.0.txt",
      "sizeBytes": 9165,
      "sha256": "b534e465949558eec2597b04f5092b5e161236a68dfbfd04d547592ac3964308",
      "licenseComponentId": "opencc-data"
    },
    {
      "kind": "repository-file",
      "role": "package-notice",
      "destination": "package-notices/licenses/UTF8PROC-LICENSE.md",
      "sourcePath": "release/compliance/package-notices/chinese/licenses/UTF8PROC-LICENSE.md",
      "sizeBytes": 5125,
      "sha256": "3b510150d34f248a221bb88e1d811238d6c6c18b51231822c42974c39bb07256",
      "licenseComponentId": "utf8proc"
    },
    {
      "kind": "repository-file",
      "role": "runtime-source",
      "destination": "runtime-source/providers/chinese-funasr/CMakeLists.txt",
      "sourcePath": "providers/chinese-funasr/CMakeLists.txt",
      "sizeBytes": 2635,
      "sha256": "24fdb921ddcc33f6e834069f6a87c1b3e2e7e368c858b2ca122fe38d80410b35",
      "licenseComponentId": "funasr"
    },
    {
      "kind": "repository-file",
      "role": "runtime-source",
      "destination": "runtime-source/providers/chinese-funasr/src/audio.cpp",
      "sourcePath": "providers/chinese-funasr/src/audio.cpp",
      "sizeBytes": 1979,
      "sha256": "f02673b09cdf89e432a2131ada57f1317a1d64c8c52b3343ea449632143491ff",
      "licenseComponentId": "funasr"
    },
    {
      "kind": "repository-file",
      "role": "runtime-source",
      "destination": "runtime-source/providers/chinese-funasr/src/audio.h",
      "sourcePath": "providers/chinese-funasr/src/audio.h",
      "sizeBytes": 201,
      "sha256": "f450bebadbfc18e24c3b97fb21b2546ecba406739748a459789aeac7a6f450d2",
      "licenseComponentId": "funasr"
    },
    {
      "kind": "repository-file",
      "role": "runtime-source",
      "destination": "runtime-source/providers/chinese-funasr/src/audio_features.cpp",
      "sourcePath": "providers/chinese-funasr/src/audio_features.cpp",
      "sizeBytes": 5394,
      "sha256": "ac62276109362a1e4588e711e622a86e1140d0157157e28872e4791f516cb27d",
      "licenseComponentId": "funasr"
    },
    {
      "kind": "repository-file",
      "role": "runtime-source",
      "destination": "runtime-source/providers/chinese-funasr/src/audio_features.h",
      "sourcePath": "providers/chinese-funasr/src/audio_features.h",
      "sizeBytes": 208,
      "sha256": "c6ab4f8c1db60eb52a77590dcc531be8c0523326df55dd66a92c2a705d948b06",
      "licenseComponentId": "funasr"
    },
    {
      "kind": "repository-file",
      "role": "runtime-source",
      "destination": "runtime-source/providers/chinese-funasr/src/funasr_engine.cpp",
      "sourcePath": "providers/chinese-funasr/src/funasr_engine.cpp",
      "sizeBytes": 12792,
      "sha256": "e2c2db6290b98abe55440c10d90683e99ceafdc67e2e2327b3230b4713ab943d",
      "licenseComponentId": "funasr"
    },
    {
      "kind": "repository-file",
      "role": "runtime-source",
      "destination": "runtime-source/providers/chinese-funasr/src/funasr_engine.h",
      "sourcePath": "providers/chinese-funasr/src/funasr_engine.h",
      "sizeBytes": 591,
      "sha256": "285662e176acab00b82079d79da2ef6463c8aa9345da3fabf424b094c63a638b",
      "licenseComponentId": "funasr"
    },
    {
      "kind": "repository-file",
      "role": "runtime-source",
      "destination": "runtime-source/providers/chinese-funasr/src/main.cpp",
      "sourcePath": "providers/chinese-funasr/src/main.cpp",
      "sizeBytes": 7185,
      "sha256": "88e4d3f222f72618ecc57b4a3c2de734d2799fb3e5a9d97e0a70dcdbdfcc6cbc",
      "licenseComponentId": "funasr"
    },
    {
      "kind": "repository-file",
      "role": "runtime-source",
      "destination": "runtime-source/providers/chinese-funasr/src/normalization.cpp",
      "sourcePath": "providers/chinese-funasr/src/normalization.cpp",
      "sizeBytes": 7486,
      "sha256": "bc79d3026ab8c4ff50e96b7b060b4951a8bd8602afcd0878783d1d6f0736d622",
      "licenseComponentId": "funasr"
    },
    {
      "kind": "repository-file",
      "role": "runtime-source",
      "destination": "runtime-source/providers/chinese-funasr/src/normalization.h",
      "sourcePath": "providers/chinese-funasr/src/normalization.h",
      "sizeBytes": 320,
      "sha256": "e0eaaeb54fb51fff982488df97bde948943a4063b7b85cb85a7e9446d7f30949",
      "licenseComponentId": "funasr"
    },
    {
      "kind": "repository-file",
      "role": "runtime-source",
      "destination": "runtime-source/providers/chinese-funasr/src/package_integrity.cpp",
      "sourcePath": "providers/chinese-funasr/src/package_integrity.cpp",
      "sizeBytes": 1408,
      "sha256": "be743a06e21b61b31af0efab0bd0dc797fb8ac3a17604b00c2b3836dbb130be0",
      "licenseComponentId": "funasr"
    },
    {
      "kind": "repository-file",
      "role": "runtime-source",
      "destination": "runtime-source/providers/chinese-funasr/src/package_integrity.h",
      "sourcePath": "providers/chinese-funasr/src/package_integrity.h",
      "sizeBytes": 185,
      "sha256": "ebf923a82874051ba813f576538be2fc920744bbb41efaad1f97cfb3a23c7123",
      "licenseComponentId": "funasr"
    },
    {
      "kind": "repository-file",
      "role": "runtime-source",
      "destination": "runtime-source/providers/chinese-funasr/src/package_integrity_apple.cpp",
      "sourcePath": "providers/chinese-funasr/src/package_integrity_apple.cpp",
      "sizeBytes": 1570,